id,level,category,question,correct,dummy1,dummy2,dummy3,dummy4
1,1,四字熟語,「一期一会」の正しい意味は？,一生に一度だけの出会い,一つの期に一回休むこと,最初の出会いを忘れること,一ヶ月に一度会うこと,一人で生きていくこと
2,1,慣用句,「耳にたこができる」の意味は？,同じことを何度も聞かされて不愉快な気持ちになること,耳の病気になってしまい音が聞こえなくなること,海の生き物の声が遠くから聞こえてくること,耳がどんどん大きくなっていく不思議な病気,他人の悪口ばかり聞こえてきて嫌になること
3,1,ことわざ,「猿も木から落ちる」の意味は？,得意なことでも失敗することがある,猿は木登りが下手だということ,高いところは危ないということ,動物を大切にしようということ,木から落ちると大ケガをすること
4,1,類義語・対義語,「出発」の対義語（反対の意味）は？,到着,進行,帰宅,外出,開始
5,1,文法,「美しい花が咲く」の「美しい」は何詞？,形容詞,動詞,名詞,副詞,接続詞
6,2,四字熟語,「以心伝心」の正しい意味は？,言葉にしなくてもお互いの気持ちが自然に通じ合うこと,心臓の病気を隠さずに周りの人にちゃんと伝えること,手紙やメールで自分の本当の気持ちを誰かに伝えること,心を込めて手作りのお弁当を作って人にプレゼントすること,嘘の気持ちを間違えて別の人に伝えてしまい後悔すること
7,2,慣用句,「さじを投げる」の意味は？,どうにもならずあきらめること,スプーンを投げて遊ぶこと,料理を失敗すること,薬を飲むこと,勢いよく物を投げること
8,2,ことわざ,「馬の耳に念仏」の意味は？,いくら意見を言っても相手が理解せず効き目がないこと,馬はお経を聞くのが大好きでいつも聞いているということ,耳元でいきなり大きな声を出して相手を驚かせること,馬に人間の言葉を教えて話せるようにしようとすること,お寺に行ってありがたいお話を長く聞かせてもらうこと
9,2,類義語・対義語,「原因」の対義語（反対の意味）は？,結果,理由,起源,発端,過程
10,2,文法,「走る」の丁寧語はどれ？,走ります,走られる,お走りになる,走らせる,走らされる
11,3,四字熟語,「四面楚歌」の正しい意味は？,周りが敵ばかりで助けがない状態,四つの面を持つ珍しい歌,東西南北から歌が聞こえること,みんなで楽しく歌うこと,四人で協力して戦うこと
12,3,慣用句,「図に乗る」の意味は？,相手に褒められたりしていい気になって調子づくこと,図形の上に立ってバランスをとる難しい遊びのこと,計画通りに全てが順調に進んでいて安心していること,地図を見ながら目的地に迷わず真っ直ぐ進むこと,新しい乗り物に乗って遠くまでドライブに出かけること
13,3,ことわざ,「情けは人の為ならず」の正しい意味は？,人に親切にすると巡り巡って自分のためになる,人に親切にするのはその人のためにならない,困っている人は助けないほうがいい,情けをかけると自分が損をする,冷たくするのが本当の優しさだ
14,3,類義語・対義語,「豊富」の類義語（似た意味）は？,豊か,不足,貧しい,少ない,単調
15,3,文法,「食べる」の尊敬語（相手を高める言い方）はどれ？,召し上がる,いただく,食う,食べます,お食べする
16,4,四字熟語,「悪戦苦闘」の正しい意味は？,とても困難な状況の中で必死に努力して戦い続けること,悪いことをしてその報いを受けてしまいひどく苦しむこと,戦いが嫌になって途中で逃げ出してしまう卑怯なこと,悪い敵といつの間にか仲良くなって友達になってしまうこと,苦しい戦いの中にあってもそれを心から楽しむこと
17,4,慣用句,「気が置けない」の正しい意味は？,全く遠慮する必要がなく心から打ち解けて話せること,どうしても気が合わず誰とも仲良くなれない様子のこと,相手に対する注意が足りずにすぐ失敗してしまうこと,嫌なことがあって急に気分が悪くなり倒れてしまうこと,相手のことを思いやれず自分勝手に行動してしまうこと
18,4,ことわざ,「灯台下暗し」の意味は？,身近なことほど意外に気がつかないことが多いものだ,灯台の下はとても暗くて危ないから気をつけよう,暗い夜道を歩く時は足元に十分気をつけよう,遠くにあるものほど意外によく見えるものだ,海の近くは街灯が少なくてどうしても暗くなりがちだ
19,4,類義語・対義語,「拡大」の対義語（反対の意味）は？,縮小,減少,低下,悪化,後退
20,4,文法,「雨が降る」の「降る」は何詞？,動詞,名詞,形容詞,副詞,接続詞
21,5,四字熟語,「試行錯誤」の正しい意味は？,失敗を何度も繰り返しながら解決方法をやっと見つけ出すこと,難しい試験に何度も落ちてしまいすっかり自信をなくすこと,悪い行いをしてしまった後に深く反省して謝ること,間違った道をわざと選んで遠回りして目的地に向かうこと,考えることを完全にやめてしまって誰かに頼りきること
22,5,慣用句,「役不足」の正しい意味は？,自分の能力に対して与えられた役目が軽すぎること,自分の能力が足りなくて役目が果たせないこと,劇の役者が足りないこと,役目を途中で交代すること,役に立たないこと
23,5,ことわざ,「豚に真珠」と同じ意味のことわざは？,猫に小判,犬も歩けば棒に当たる,猿も木から落ちる,泣きっ面に蜂,蛙の子は蛙
24,5,類義語・対義語,「長所」の対義語（反対の意味）は？,短所,欠点,弱点,不良,悪所
25,5,文法,「行く」の謙譲語（自分がへりくだる言い方）はどれ？,参る,いらっしゃる,行かれます,おいでになる,行かれる
26,1,四字熟語,「十人十色」の正しい意味は？,人の考えや好みは十人いれば十通りあってそれぞれ違うこと,十人で集まって十種類の絵の具を使って絵を描き上げること,十人集まればみんなで虹色のような美しい輪を作れること,話し合った結果としてみんなが全く同じ素晴らしい考えになること,ここにいる十人の顔の色がそれぞれ少しずつ違っていること
27,1,慣用句,「道草を食う」の意味は？,目的地へ行く途中で他のことをして無駄に時間を費やすこと,道に生えている雑草を摘んでむしゃむしゃと食べてしまうこと,お腹が空きすぎて歩けなくなり途中で倒れ込んでしまうこと,目的の場所がわからなくなり道に迷ってすっかり困ってしまうこと,草むらに入って友達と日が暮れるまで楽しく遊んでしまうこと
28,1,ことわざ,「犬も歩けば棒に当たる」の意味は？,何かをしていると思いがけない幸運あるいは災難にあうこと,犬は外を歩いているとしょっちゅう棒で叩かれるということ,外を歩いているとちょうどいい長さの棒を拾うことができること,犬は棒きれを投げて遊んでもらうのが一番好きだということ,長い棒を持っていればどんなに強い犬にでも勝てるということ
29,1,類義語・対義語,「開始」の対義語（反対の意味）は？,終了,出発,進行,失敗,中断
30,1,文法,「静かに本を読む」の「静かに」は何詞？,副詞,形容詞,動詞,名詞,接続詞
31,2,四字熟語,「右往左往」の正しい意味は？,混乱してあっちへ行ったりこっちへ行ったりして迷うこと,右と左を何度も間違えてしまい目的地になかなか着けないこと,右利きの人と左利きの人が一緒になって作業をすること,交差点を安全確認しながらゆっくりと歩いて渡ること,寄り道をせずに目的地に向かってひたすら真っ直ぐ進むこと
32,2,慣用句,「油を売る」の意味は？,仕事の途中で無駄話をしてしまって怠けて時間を潰すこと,油を普段よりだいぶ高く売ってたくさん儲けようとすること,夕飯の料理の準備をするために台所をきれいに片付けること,自分より偉い人に気に入られようとして誰かに媚びを売ること,わざと相手の嫌がることを言ってひどく怒らせてしまうこと
33,2,ことわざ,「石の上にも三年」の意味は？,つらくて厳しいことでも我慢して続ければ必ず成功する,冷たい石の上に三年も座り続けると重い病気にかかってしまう,どんなに重い石でも三年経てば少しは動くようになる,これから三年間はとにかく何もせずにじっとしていなければならない,どんなに硬い石でも三年間外に置いておけば風化して壊れる
34,2,類義語・対義語,「容易」の類義語（似た意味）は？,簡単,困難,複雑,難解,面倒
35,2,文法,次のうち、接続詞はどれ？,しかし,赤い,静かに,走る,犬
36,3,四字熟語,「一石二鳥」の正しい意味は？,一つのことをするだけで同時に二つの大きな利益を得ること,一つの石を投げて二羽の鳥をわざと逃がしてあげること,石を二つ同時に投げて空を飛んでいる鳥を捕まえること,鳥が口に石を二つ咥えて自分のところに運んでくること,二羽の鳥が落ちている小さな石を奪い合って喧嘩すること
37,3,慣用句,「腹を割る」の意味は？,本心を隠さずに打ち明けること,お腹が痛くなること,お腹を切って手術すること,怒りを爆発させること,お腹いっぱい食べること
38,3,ことわざ,「弘法にも筆の誤り」の意味は？,名人でも失敗することがある,書道家は筆をよく間違える,筆の選び方が大事だ,弘法大師は字が下手だった,良い筆を使えば上手く書ける
39,3,類義語・対義語,「悲観」の対義語（反対の意味）は？,楽観,失望,絶望,安心,後悔
40,3,文法,「見る」の尊敬語（相手を高める言い方）はどれ？,ご覧になる,拝見する,見られる,見ます,お見せする
41,4,四字熟語,「前代未聞」の正しい意味は？,今まで一度の聞いたこともないような非常に珍しい出来事,前の時代に大流行してみんながよく歌っていた音楽のこと,昔の人が話してくれた大切な教えを全く聞かないこと,何かを始める前に前もってみんなから聞いておくべき重要事項,昔からみんながよく聞いていてすでに知っているお馴染みの話
42,4,慣用句,「口を切る」の意味は？,最初に話し始めること,口にケガをすること,お菓子の袋を開けること,約束を破ること,黙り込んでしまうこと
43,4,ことわざ,「河童の川流れ」と同じ意味のことわざは？,猿も木から落ちる,犬も歩けば棒に当たる,豚に真珠,石の上にも三年,馬の耳に念仏
44,4,類義語・対義語,「許可」の類義語（似た意味）は？,承認,禁止,拒否,中止,命令
45,4,文法,「来る」の謙譲語（自分がへりくだる言い方）はどれ？,参る,いらっしゃる,おいでになる,来られる,来ます
46,5,四字熟語,「大器晩成」の正しい意味は？,偉大な人物は遅れて実力を発揮して最後には大成するということ,大きくて立派な器を作るのにはとても長い時間がかかるということ,夕方になってから大きなどんぶりでご飯をたくさん食べること,年をとってからとても大きくて取り返しのつかない失敗をすること,最初から素晴らしい才能を発揮してみんなを驚かせること
47,5,慣用句,「水を差す」の意味は？,仲の良い間柄や上手くいっている事の途中に邪魔に入ること,熱いお茶に冷たい水を入れてちょうどいい温度に薄めること,庭に咲いている綺麗な花にたっぷりと水を与えて育てること,お風呂の温度が熱すぎるので水を入れて少し下げること,川の流れに逆らわずにただただ水を流し続けること
48,5,ことわざ,「急がば回れ」の正しい意味は？,急ぐ時ほどかえって時間がかかっても安全で確実な道を通るべきだ,急いでいる時はとにかく周りを気にせず誰よりも早く走るべきだ,急いでいる時こそ立ち止まって落ち着いて周りを見回すべきだ,どんなに急いだって結局は出せる結果は同じになるということ,急ぐと目が回ってしまってかえって遅れてしまうということ
49,5,類義語・対義語,「保守」の対義語（反対の意味）は？,革新,維持,保護,管理,発展
50,5,文法,「言う」の尊敬語（相手を高める言い方）はどれ？,おっしゃる,申す,言われる,言います,お言いになる
51,1,四字熟語,「弱肉強食」の意味は？,強い者が弱い者を犠牲にして栄えること,お肉を食べて強くなること,弱いお肉と強いお肉を食べ比べること,動物たちが仲良く暮らすこと,食事を無理やり食べさせること
52,1,慣用句,「すずめの涙」の意味は？,ほんのわずかしかないこと,鳥が悲しんで泣いていること,目薬をさすこと,とてもたくさんの量のこと,小さくて可愛いもの
53,1,ことわざ,「鬼に金棒」の意味は？,強いものがさらに強くなること,鬼が金持ちになること,鉄の棒で叩かれること,怖いものから逃げること,悪いことをしてはいけないということ
54,1,類義語・対義語,「肯定」の対義語（反対の意味）は？,否定,賛成,絶対,確認,決定
55,1,文法,「静かだ」は何詞？,形容動詞,形容詞,動詞,名詞,副詞
56,2,四字熟語,「一長一短」の正しい意味は？,どんなものにも良いところもあればそれなりに悪いところもあること,とても長い紐ととても短い紐とをくっつけて遊ぶこと,すごく背が高い人とすごく背が低い人がたまたま並んでいること,何かを始めてもすぐに飽きてしまいあっという間に終わってしまうこと,たった一つのことだけが誰よりも素晴らしいくらいに得意なこと
57,2,慣用句,「目を丸くする」の意味は？,とても驚くこと,目が疲れてしまうこと,丸いメガネをかけること,怒ってにらみつけること,眠くて目をこすること
58,2,ことわざ,「壁に耳あり障子に目あり」の意味は？,秘密はどこからか漏れやすいということ,家の中にはお化けがいるということ,壁や障子を壊してはいけないこと,周りをよく見て歩くべきだということ,古い家は隙間風が入ること
59,2,類義語・対義語,「減少」の対義語（反対の意味）は？,増加,拡大,低下,発展,縮小
60,2,文法,「とても」や「少し」のように、様子や程度を表す品詞は？,副詞,接続詞,形容詞,名詞,動詞
61,3,四字熟語,「自業自得」の正しい意味は？,自分の悪い行いの報いを自分で受けること,自分で自分の仕事を褒めること,農業を自分で始めること,自分で作ったものを自分で食べること,得意なことを自慢すること
62,3,慣用句,「鼻が高い」の意味は？,得意になっていること,鼻の形がきれいなこと,嘘をついて鼻が伸びること,匂いに敏感なこと,風邪をひいて鼻水が出ること
63,3,ことわざ,「善は急げ」の意味は？,良いと思ったことはすぐに実行するべきだ,良いことをするには急いで走るべきだ,急ぐと良いことがある,急ぐ時は良い道を選べ,良い結果を出すには焦りが必要だ
64,3,類義語・対義語,「賛同」の類義語（似た意味）は？,同意,反対,拒否,抵抗,無視
65,3,文法,「犬が走る」の「が」は何詞？,助詞,接続詞,名詞,副詞,動詞
66,4,四字熟語,「言語道断」の正しい意味は？,とても言葉では言い表せないほどもってのほかでありひどいこと,言葉が通じるコミュニケーションの道をばっさりと断ち切ること,外国の言葉を絶対に話してはいけないという厳しいルールのこと,話すのをきっぱりやめてずっと黙り込んでしまうこと,見知らぬ人に道を尋ねるのがとても苦手でいつも迷うこと
67,4,慣用句,「歯に衣着せぬ」の意味は？,相手に気兼ねすることなく自分の思った通りに率直に意見を言うこと,歯医者さんに行って痛い虫歯の治療をしっかりと受けること,面倒くさがって食後の歯磨きを全くせずに寝てしまうこと,冬の厳しい寒さに備えて服を何枚も重ねて厚着をすること,うまく嘘をついてその場の気まずい雰囲気を適当にごまかすこと
68,4,ことわざ,「捕らぬ狸の皮算用」の意味は？,まだ手に入っていないものを当てにしてあれこれと計画を立てること,野生のタヌキを捕まえてその毛皮を高く売ろうとすること,お店でお金の計算をすっかり間違えてしまい損をしてしまうこと,弱い動物をいじめてはいけないという教えのこと,失敗しないようにお金の計算は必ず慎重にすべきだということ
69,4,類義語・対義語,「平凡」の対義語（反対の意味）は？,非凡,普通,単純,退屈,異常
70,4,文法,「おっしゃる」は何語？,尊敬語,謙譲語,丁寧語,美化語,俗語
71,5,四字熟語,「傍目八目」の正しい意味は？,当事者よりも第三者のほうが物事を冷静に正しく判断できること,顔の周りに八つも目を持っている恐ろしい化け物のこと,囲碁の勝負で八目もの点差をつけられて負けてしまうこと,落ち着きがなく周りをキョロキョロと見回してばかりいること,他人の目を気にしすぎて極度に緊張し何もできなくなってしまうこと
72,5,慣用句,「手をこまねく」の正しい意味は？,何もせずにただ見ていること,手を洗ってきれいにすること,手招きして人を呼ぶこと,手をつないで仲良くすること,腕相撲の準備をすること
73,5,ことわざ,「立つ鳥跡を濁さず」の意味は？,その場を立ち去る者はきれいに後始末を済ませてから行くべきである,鳥が一斉に飛び立つと水面が泥でひどく濁ってしまうということ,鳥はとてもきれい好きでいつも体を洗い流しているということ,服が汚れるから泥水の中に入って遊んではいけないという注意,一度進んだからには絶対に後戻りをしてはならないというルール
74,5,類義語・対義語,「必然」の対義語（反対の意味）は？,偶然,確実,絶対,自然,当然
75,5,文法,「拝見する」は何語？,謙譲語,尊敬語,丁寧語,美化語,外来語
76,1,四字熟語,「一石二鳥」の意味は？,一つのことで二つの利益を得ること,鳥に石を投げること,石を二つ持って鳥を追いかけること,鳥が石を運んでくること,二羽の鳥がケンカすること
77,1,慣用句,「腹が立つ」の意味は？,怒ること,お腹が痛くなること,立ち上がること,お腹いっぱい食べること,空腹で力が出ないこと
78,1,ことわざ,「猫に小判」の意味は？,価値の全くわからない人に高価なものをあげてもなんの無駄だということ,猫はとてもお金が好きでいつも小判を探しているということ,猫がいっぱいいる家には泥棒が入りやすいから注意が必要だということ,無駄遣いをせずにお金を大切に扱おうという教えのこと,猫を見つけたら誰の猫でも優しく可愛がってあげようということ
79,1,類義語・対義語,「開始」の類義語（似た意味）は？,スタート,ゴール,ストップ,エンド,リセット
80,1,文法,「大きい」は何詞？,形容詞,動詞,名詞,形容動詞,助詞
81,2,四字熟語,「異口同音」の正しい意味は？,たくさんの人がそれぞれ口を揃えてみんな同じ意見を言うこと,自分とは違う遠い国の珍しい言葉を頑張って話そうとすること,人の口の形はそれぞれ少しずつ違っていて個性的だということ,音楽の授業でみんなで揃って楽しい歌を元気に歌うこと,風邪をひいてしまって少し変な声が出てしまうこと
82,2,慣用句,「羽を伸ばす」の意味は？,気兼ねなくのびのびと振る舞うこと,鳥が空を飛ぶ練習をすること,背伸びをして背を高くすること,疲れて休むこと,体操をすること
83,2,ことわざ,「ちりも積もれば山となる」の意味は？,どんなにわずかなものでも積み重ねればいずれは大きなものになる,ゴミはため込まずにこまめに掃除して捨てるべきだという教え,山の奥には人が捨てたゴミがたくさん落ちているということ,掃除をサボっているとゴミがすぐ山のようにたまってしまうこと,砂場で小さな山を作って友達と楽しく遊ぶこと
84,2,類義語・対義語,「失敗」の対義語（反対の意味）は？,成功,後悔,反省,中止,大勝
85,2,文法,「しかし」は何詞？,接続詞,副詞,名詞,助詞,動詞
86,3,四字熟語,「半信半疑」の正しい意味は？,本当かどうかについて半分だけ信じて残り半分は疑っている状態,半分だけは神様を信じてお祈りし半分は信じていないこと,人のことを疑うのはとても悪いことだという強い教えのこと,テストの点数が自分の予想していたもののちょうど半分だったこと,相手との約束を半分だけ守ってあとは破ってしまうこと
87,3,慣用句,「足を洗う」の正しい意味は？,悪い行いをやめて正業につくこと,お風呂で足をきれいにすること,歩き疲れて足をマッサージすること,足を滑らせて転ぶこと,泥水に入ること
88,3,ことわざ,「朱に交われば赤くなる」の意味は？,人は関わる友人や周りの環境によって良くも悪くも影響を受けるものだ,いろんな色の絵の具の中に赤い絵の具を混ぜると全体が赤くなること,きれいな夕日を見ると反射して顔が赤く見えるということ,人前で緊張して恥ずかしくなってしまい顔が真っ赤になること,赤い服を着て出かけると気分が上がって元気になるということ
89,3,類義語・対義語,「容易」の対義語（反対の意味）は？,困難,簡単,複雑,単調,平易
90,3,文法,「きらきらと」や「ワンワンと」のように音や様子を表す言葉を何という？,擬音語・擬態語,接続詞,名詞,動詞,形容詞
91,4,四字熟語,「温故知新」の正しい意味は？,昔のことをしっかり学んでそこから新しい知識や道理を得ること,家にある古いものを全部捨てて新しいものをどんどん買うこと,古い温泉に入って心身ともに新しくしっかり生まれ変わること,昔の友達と久しぶりに会って新しく出会い直して仲良くなること,図書館に行ってとても古くて難しい本を一日中読むこと
92,4,慣用句,「肝を冷やす」の意味は？,危ない目にあってヒヤッとし心底驚き恐れて冷や汗をかくこと,とても冷たいものをたくさん飲んでお腹をこわしてしまうこと,夏の暑い夜に肝だめしをしてわざと涼むこと,冬の厳しい寒さのせいで体が芯まで冷え切ってしまうこと,買ったばかりの食べ物を早く冷やそうと冷蔵庫に入れること
93,4,ことわざ,「二兎を追う者は一兎をも得ず」の意味は？,同時に二つのことをしようと欲張ると結局両方とも失敗してしまう,うさぎは素早いから二匹も同時に捕まえるのは無理だということ,野原で二匹のうさぎを追いかけるのはとても楽しいということ,うさぎを追いかける時は必ず一匹ずつ順番に捕まえろという教え,色々なものを欲張ると周りの人からひどく怒られるということ
94,4,類義語・対義語,「複雑」の対義語（反対の意味）は？,単純,困難,簡単,面倒,難解
95,4,文法,「行かれる」は何語？,尊敬語,謙譲語,丁寧語,美化語,外来語
