id,level,category,question,correct,dummy1,dummy2,dummy3,dummy4
96,5,四字熟語,「画竜点睛」の正しい意味は？,物事を完全に完成させるための最後のとても大事な仕上げのこと,大きな壁にとても立派な竜の絵を時間をかけて描くこと,目が疲れた時に目薬をさしてリフレッシュすること,天気の良い晴れた日に外に出て風景の絵を描くこと,絵の具が服にべったりとついてしまって取れなくなること
97,5,慣用句,「舌を巻く」の意味は？,ひどく驚き感心すること,舌を火傷してしまうこと,ご飯を急いで食べること,嘘をつくこと,舌を出してあっかんべーをすること
98,5,ことわざ,「能ある鷹は爪を隠す」の意味は？,本当に実力のある人はやたらとそれをひけらかしたりしないものだ,鷹は獲物を捕る一瞬の時だけ鋭い爪を出すということ,爪をちゃんと隠しておかないと怪我をして危ないということ,鷹は自分の爪を研いで鋭くしておくのが好きだということ,自分の優れた才能は誰にも見せずに隠しておいたほうがいいこと
99,5,類義語・対義語,「需要」の対義語（反対の意味）は？,供給,消費,生産,販売,購入
100,5,文法,「申す」は何語？,謙譲語,尊敬語,丁寧語,美化語,俗語
101,1,四字熟語,「一進一退」の意味は？,進んだり退いたりすること,一度進んだら二度と戻らないこと,一歩進んで一回休むこと,一つずつ退学していくこと,全員で一斉に進むこと
102,1,慣用句,「顔が広い」の意味は？,知り合いがたくさんいること,顔のサイズが大きいこと,笑顔でいることが多いこと,遠くまでよく見えること,恥ずかしくて顔が赤くなること
103,1,ことわざ,「どんぐりの背比べ」の意味は？,どれも似たり寄ったりでこれといって抜きん出た者がいないこと,秋の森でたくさんのどんぐりを拾ってきて家で集めること,背が高い方が何事においても偉くて優れているということ,背伸びをして自分のことを実際よりも大きく見せようとすること,秋の涼しい山に出かけて友達と一日中走り回って遊ぶこと
104,1,類義語・対義語,「安全」の対義語（反対の意味）は？,危険,安心,保護,注意,平和
105,1,文法,「きれいだ」は何詞？,形容動詞,形容詞,名詞,動詞,副詞
106,2,四字熟語,「大同小異」の意味は？,だいたい同じで小さな違いしかないこと,大きな子どもと小さな子ども,大きく違っていて少しだけ同じこと,大きな音と小さな音,大きく同意して少し反対すること
107,2,慣用句,「口が堅い」の意味は？,他人から聞いた秘密を誰にも絶対に漏らさず心に留めておくこと,頑固で絶対に口を開かず誰とも一言も話さないこと,硬い食べ物を時間をかけてよく噛んで食べること,虫歯が全くなく歯がとても丈夫で何でも食べられること,相手に対する言葉使いがいつも非常に細かく厳しいこと
108,2,ことわざ,「焼け石に水」の意味は？,少しばかりの努力や援助をしたところであまりにも全く効果がないこと,とても熱い石に冷たい水をかけて急激に冷ますこと,石を火で熱く焼いてその上で美味しい料理を作ること,すごく喉が渇いてたまらなくなり水をがぶ飲みすること,火事が起きた時にバケツで水をかけて火を消そうとすること
109,2,類義語・対義語,「利益」の対義語（反対の意味）は？,損失,もうけ,お金,結果,豊富
110,2,文法,「だから」は何詞？,接続詞,副詞,名詞,動詞,形容詞
111,3,四字熟語,「悪口雑言」の意味は？,さんざん悪口を言うこと,悪い言葉と難しい言葉,口にチャックをすること,悪い夢を見ること,大きな声で歌うこと
112,3,慣用句,「耳を疑う」の意味は？,信じられないことを聞いて驚くこと,耳の病気ではないかと心配すること,他人の言うことを全く信じないこと,耳が遠くなること,こっそり立ち聞きすること
113,3,ことわざ,「泣きっ面に蜂」の意味は？,すでに悪いことが起きている上にさらに悪いことが重なってしまうこと,外で泣いているとどこからともなく蜂が飛んで寄ってくること,スズメバチに刺されて痛くてたまらずに大声で泣き叫ぶこと,泣いたあとに顔が蜂に刺されたように大きく腫れてしまうこと,悲しくて泣いている時に甘いものを食べて気を紛らわせること
114,3,類義語・対義語,「拡大」の類義語（似た意味）は？,拡張,縮小,減少,低下,悪化
115,3,文法,「食べる」の謙譲語（自分がへりくだる言い方）は？,いただく,召し上がる,食べられる,お食べになる,食う
116,4,四字熟語,「意味深長」の意味は？,普通に聞こえる言葉の裏にとても深い意味が隠されていること,言葉の意味が長すぎてどうしても覚えられないこと,背が伸びて同級生の中で身長がとても高くなっていること,誰も行ったことのないような深い海の中を潜水艦で探検すること,何回読んでも言葉の意味が全くわからなくて困ってしまうこと
117,4,慣用句,「鼻を明かす」の意味は？,相手をうまく出し抜いてあっと言わせるような思い知らせ方をすること,詰まっていた鼻を勢いよくかんでとてもスッキリすること,今まで誰にも言えなかった秘密を思い切って打ち明けること,夜明けの光が見えるまで一晩中全く眠らずに起きていること,転んで顔をぶつけてしまい急に鼻血を吹き出してしまうこと
118,4,ことわざ,「釈迦に説法」の意味は？,自分よりはるかに詳しいプロに向かって教えようとする見苦しい愚かさのこと,お寺に集まってお坊さんと一緒にお経を長く読むこと,偉大な仏様に向かって静かに手を合わせてお祈りをすること,学校の先生のとてもありがたいお話を静かに聞くこと,お釈迦様が誰も見たことない不思議な魔法を使うこと
119,4,類義語・対義語,「原因」の対義語（反対の意味）は？,結果,理由,発端,始まり,過程
120,4,文法,「見る」の謙譲語（自分がへりくだる言い方）は？,拝見する,ご覧になる,見られる,お見せする,見ます
121,5,四字熟語,「絶体絶命」の意味は？,どうしても逃れられないような非常に困難な立場に追い込まれること,上司や先輩の命令は絶対に聞かなければならないという厳しいルール,怪我や病気でいよいよ寿命が完全に尽きてしまう直前のこと,どんなに強い相手と戦っても絶対に負けない自信があること,突然体が金縛りにあって一歩も動かなくなってしまうこと
122,5,慣用句,「歯が浮く」の意味は？,お世辞などの気障なセリフを聞かされてとても不快な気持ちになること,虫歯が悪化してしまい大切な歯が抜けてしまうこと,歯医者さんに行って痛い虫歯の治療をしてもらうこと,夏の海に出かけて浮き輪に浮かんでぷかぷかと遊ぶこと,毎日の歯磨きをしっかりして口の中がスッキリすること
123,5,ことわざ,「瓢箪から駒」の意味は？,単なる冗談で言ったことが本当に現実のこととして起こってしまうこと,小さな瓢箪の中からいきなり大きな馬が飛び出してくること,昔ながらの駒というおもちゃを上手に回して遊ぶこと,栄養が足りなくてひょろひょろに痩せ細ってしまった馬のこと,畑で採れた野菜を使って手作りのおもちゃを作ること
124,5,類義語・対義語,「悲観」の対義語（反対の意味）は？,楽観,絶望,失望,安心,後悔
125,5,文法,「いる」の尊敬語（相手を高める言い方）は？,いらっしゃる,おる,います,いられる,ある
126,1,四字熟語,「千載一遇」の意味は？,千年に一度しかないようなまたとない非常に素晴らしいチャンスのこと,同じ人と偶然にも千回くらいばったり出会ってしまうこと,願い事を叶えるために千羽の鶴を一生懸命に折ること,生きている間に一度しか会えないとても不思議な運命のこと,久しぶりに偶然道端で昔の友達とばったり会うこと
127,1,慣用句,「足が棒になる」の意味は？,歩き疲れて足がこわばること,足が長くなること,足に棒が刺さること,立ちっぱなしで怒ること,杖をついて歩くこと
128,1,ことわざ,「猿知恵」の意味は？,人間が考えるような浅はかで全く役に立たないようなつまらない知恵のこと,猿のように動物の中ではとても賢くて頭が良いこと,猿が木から絶対に落ちないように工夫したすごい知恵のこと,野生の動物を傷つけずに大切に保護するための知恵のこと,猿がバナナをとても上手に早く剥いておいしく食べる知恵のこと
129,1,類義語・対義語,「過去」の対義語（反対の意味）は？,未来,現在,昔,歴史,昨日
130,1,文法,「高い」は何詞？,形容詞,動詞,名詞,形容動詞,助詞
131,2,四字熟語,「日進月歩」の意味は？,日ごと月ごとに絶えず驚くようなスピードでどんどん進歩し続けること,健康のために毎日少しずつ休まずにウォーキングすること,宇宙飛行士になって遠く離れた月面を歩くこと,月が変わるたびに壁掛けカレンダーのページをめくること,夕方に日が沈んで暗くなると明るい月が出てくること
132,2,慣用句,「首を長くする」の意味は？,期待して待ち焦がれること,ろくろ首のお化けのこと,背伸びをして遠くを見ること,首を鍛えること,退屈して眠くなること
133,2,ことわざ,「覆水盆に返らず」の意味は？,一度してしまった失敗は二度と取り返しがつかないという厳しい教えのこと,誤ってこぼしてしまった水をお盆でなんとか受け止めようとすること,夏のお盆休みの時期にお墓にきれいな水をまくこと,食事を運んでいる時にお盆ごとひっくり返して全部こぼすこと,服も靴も汚れてしまうから泥水で激しく水遊びをしてはいけないこと
134,2,類義語・対義語,「勝利」の対義語（反対の意味）は？,敗北,優勝,失敗,成功,大勝
135,2,文法,「そして」は何詞？,接続詞,名詞,動詞,副詞,助詞
136,3,四字熟語,「有名無実」の意味は？,名前ばかりが立派に響いているだけで実際は中身が全く伴っていないこと,山で採れるとても美味しくて有名な珍しい木の実のこと,誰もが知っている有名な人が実はもうこの世にはいないということ,名前に恥じないくらい実力もとても素晴らしいレベルであること,名前がまだついていなくて誰もその存在を知らないこと
137,3,慣用句,「手を抜く」の意味は？,丁寧にやるべきことの手順を省略していい加減に済ませてしまうこと,冬の寒い日に外から帰ってきて手につけていた手袋を脱ぐこと,ズボンのポケットから急いで両手を出して作業を始めるこること,病気を治すために病院でとても難しい手術をしてもらうこと,迷子にならないように友達や家族と手をつないで引っ張ること
138,3,ことわざ,「井の中の蛙」の意味は？,狭い世界のことしか知らずもっと広い世界があることを全く知らないこと,カエルという生き物は暗くて狭い井戸の中が大好きだということ,古くて深い井戸の中にカエルを入れて飼い始めること,明るい場所よりも暗いところのほうが落ち着いて好きだということ,カエルは水の中をとても上手に泳ぐことができる生き物だということ
139,3,類義語・対義語,「労働」の類義語（似た意味）は？,作業,休憩,睡眠,食事,遊び
140,3,文法,「来る」の尊敬語（相手を高める言い方）は？,いらっしゃる,参る,来る,おいでする,来られる
141,4,四字熟語,「針小棒大」の意味は？,小さなことを大げさに言うこと,針のような棒のこと,針と棒を使って裁縫すること,痛い思いをすること,小さな針を大きく見せるマジック
142,4,慣用句,「胸をなでおろす」の意味は？,安心すること,胸が痛くなること,胸ぐらをつかむこと,ドキドキして落ち着かないこと,お腹が空くこと
143,4,ことわざ,「ぬかに釘」の意味は？,いくらやってもこれといった手ごたえがなく全く効き目がないことの例え,不器用で大工仕事の釘を打つのがとても下手なこと,美味しいぬか漬けの色を良くするために鉄の釘を入れること,とても硬い石などの上に無理やり釘を打とうとすること,プロの大工さんが家を建てるための素晴らしい仕事のこと
144,4,類義語・対義語,「集合」の対義語（反対の意味）は？,解散,集中,分散,会議,集まり
145,4,文法,「言う」の謙譲語（自分がへりくだる言い方）は？,申す,おっしゃる,言われる,言います,お言いになる
146,5,四字熟語,「羊頭狗肉」の意味は？,見かけだけ立派で中身が伴わないこと,羊と犬のお肉を食べること,羊の頭に犬の体をくっつけること,動物の肉を売るお店のこと,美味しいお肉の料理
147,5,慣用句,「青菜に塩」の意味は？,しょんぼりしてすっかり元気をなくしてしおれてしまっている様子のこと,新鮮な野菜に塩をかけてサラダにして美味しく食べること,真っ青な服を着て夏に涼しい海へ遊びに行くこと,激しく怒って顔の色が真っ青になってしまう様子のこと,レストランのシェフのようにとても料理が上手なこと
148,5,ことわざ,「骨折り損のくたびれ儲け」の意味は？,苦労しただけで何も得るところがないこと,骨を折るほど働いてお金持ちになること,疲れるまで遊ぶこと,骨折の治療にお金がかかること,一生懸命働けば報われること
149,5,類義語・対義語,「軽率」の対義語（反対の意味）は？,慎重,軽快,軽薄,重厚,簡単
150,5,文法,「する」の謙譲語（自分がへりくだる言い方）は？,いたす,なさる,される,します,おする
151,1,四字熟語,「誠心誠意」の意味は？,全く嘘をつくことなく深い真心をもって真剣に物事に当たること,自分が悪いことをしたと認めて相手に何度も何度も繰り返し謝ること,外の出来事に全く興味を失って完全に心を閉ざしてしまうこと,誠という名前を持つとても正直で真面目な性格の人のこと,誰に何を言われても自分の意見を絶対に曲げず押し通すこと
152,1,慣用句,「目を光らせる」の意味は？,何か怪しいことが起きないかどうかを周囲に厳しく目を配って見張ること,スーパーヒーローのように目から強力なビームを出すこと,真っ暗な場所でも物がはっきりと見える特殊な能力を持つこと,感動して涙を浮かべたために目がキラキラと光り輝いていること,信じられないものを見てしまって驚いて目を極限まで大きく開けること
153,1,ことわざ,「鬼の目にも涙」の意味は？,どんなに無慈悲で恐ろしい人でも時には優しい思いやりを見せること,いつもは怖い鬼が自分の非を認めて泣いて謝ること,涙が出ないから目薬をさして泣いているふりをすること,鬼という生き物は意外にもよく泣く泣き虫だということ,夜寝ている時にとても怖い夢を見て泣きながら起きてしまうこと
154,1,類義語・対義語,「出発」の類義語（似た意味）は？,開始,到着,帰宅,終了,停止
155,1,文法,「花」は何詞？,名詞,動詞,形容詞,副詞,接続詞
156,2,四字熟語,「公明正大」の意味は？,公平で隠し立てがなく正しいこと,公園で大きく遊ぶこと,明るい場所で本を読むこと,名前を大きく書くこと,大声で正しいことを言うこと
157,2,慣用句,「肩を落とす」の意味は？,結果にひどくがっかりしてすっかり元気をなくしてしまうこと,持っていた重い荷物を地面にドスンと下ろすこと,スポーツの最中に激しくぶつかって肩の骨を脱臼すること,疲れた時に誰かに優しく肩を揉んでもらってリラックスすること,生まれつき肩が下がっているようになで肩であること
158,2,ことわざ,「月とすっぽん」の意味は？,二つのものの性質が違いすぎて全く比較にならないことの例え,きれいな満月を見ながらみんなで温かい鍋料理を食べること,本当は飛べないすっぽんが羽を生やして空を飛ぶこと,丸いボールや月のようなまん丸のものの形のこと,性格や見た目がそっくりな似た者同士の二人のこと
159,2,類義語・対義語,「賛成」の対義語（反対の意味）は？,反対,同意,納得,協力,無視
160,2,文法,「読む」の丁寧語はどれ？,読みます,読まれる,お読みになる,読ませる,拝読する
161,3,四字熟語,「本末転倒」の意味は？,本当に大事なことと全くつまらないことがすっかり逆になってしまうこと,両手で抱えていた重い本をうっかり落としてしまって転ぶこと,とても分厚い長い本を諦めずに最後まで全部読み切ること,走っている最中に大きく転んでしまい大怪我をすること,本の最初と最後のページを間違えて読んでしまうこと
162,3,慣用句,「気が重い」の意味は？,これから何かをするのが嫌で心がすっかり沈んで落ち込んでしまうこと,食べ過ぎてしまって急激に体重がたくさん増えること,風邪をひいて熱が出て頭がとても重くてひどく痛くなること,部屋の中の空気がよどんでいて息苦しくなってしまうこと,モチベーションが上がりやる気に満ちあふれていること
163,3,ことわざ,「類は友を呼ぶ」の意味は？,趣味や性格が似た者同士は特に何も言わなくても自然と集まるということ,遠くにいる友達に向かって大声で名前を呼ぶこと,野生の動物たちが森の中にたくさん集まってくること,クラスの中で話せる友達がとても少ないということ,自分とは全く違う性格の人と仲良くなって親友になること
164,3,類義語・対義語,「短所」の対義語（反対の意味）は？,長所,欠点,弱点,不良,悪所
165,3,文法,「くれる」の尊敬語（相手を高める言い方）は？,くださる,いただく,もらう,くれます,あげる
166,4,四字熟語,「単刀直入」の意味は？,前置きなしにすぐ本題に入ること,一本の刀で敵に突っ込むこと,真っ直ぐな刀のこと,一人で迷路に入ること,遠回りをして話すこと
167,4,慣用句,「顔に泥を塗る」の意味は？,恥をかかせること,泥遊びをして顔が汚れること,泥パックをして肌をきれいにすること,転んで顔をぶつけること,絵の具で顔に落書きすること
168,4,ことわざ,「帯に短したすきに長し」の意味は？,中途半端な長さのためどちらの用途にも全く役に立たないこと,帯とたすきの長さを定規で測ってどっちが長いか比べること,子どもの背が急に伸びて昔の服が全く合わなくなること,和服の着付けが下手で帯やたすきをうまく結べないこと,自分の体にちょうどいいピッタリのサイズの服のこと
169,4,類義語・対義語,「複雑」の類義語（似た意味）は？,ややこしい,単純,簡単,明快,容易
170,4,文法,「もらう」の謙譲語（自分がへりくだる言い方）は？,いただく,くださる,もらう,もらえる,拝借する
171,5,四字熟語,「孤軍奮闘」の意味は？,味方からの助けが全くない中でたった一人で一生懸命に努力して戦うこと,大勢の軍隊が森の中で一人ぼっちで迷子になってしまうこと,ピンチの時こそみんなで力を合わせて助け合いながら強敵と戦うこと,怒りに任せて周りのものを壊しながらたった一人で暴れ回ること,敵が強すぎて怖くなり戦うのを途中でやめて一目散に逃げること
172,5,慣用句,「目を疑う」の意味は？,信じられないものを見て驚くこと,視力が悪くなったと心配すること,他人の目を気にすること,目薬を間違えること,まぶしくて目を細めること
173,5,ことわざ,「紺屋の白袴」の意味は？,他人のために忙しく働きすぎて肝心の自分のことに全く手が回らないこと,真っ青な服の下に真っ白なズボンを合わせるファッションのこと,汚れた袴を洗濯機で洗って真っ白できれいな状態にすること,染め物屋さんが仕事をサボって遊んでばかりいること,お出かけの前に鏡を見ておしゃれにとても気を使うこと
174,5,類義語・対義語,「偶然」の対義語（反対の意味）は？,必然,突然,自然,奇跡,たまたま
175,5,文法,「行く」の尊敬語（相手を高める言い方）は？,いらっしゃる,参る,行かれます,行く,伺う
176,1,四字熟語,「一心不乱」の意味は？,よそ見をせずに一つのことだけに集中して他のことに一切気をとられないこと,一つの心がバラバラに乱れてしまいパニックに陥ること,みんなの心を一つにまとめて大きなチームワークを作ること,一生懸命走ったせいでとても息が乱れて苦しくなること,何も難しいことを考えずにただただボーッと過ごすこと
177,1,慣用句,「手を貸す」の意味は？,手伝うこと,手袋を貸してあげること,握手をすること,手を洗ってあげること,お金を貸すこと
178,1,ことわざ,「頭隠して尻隠さず」の意味は？,自分の悪事や欠点を完全に隠したつもりでも実は一部が丸見えであること,ズボンが破れてしまってお尻が丸出しになっているとても恥ずかしい状態,外出する時に頭に温かい帽子を深くかぶって出かけること,かくれんぼで鬼になり周りを見ないように目を隠していること,とても恥ずかしくて思わず両手で自分の顔をすっかり隠すこと
179,1,類義語・対義語,「幸福」の対義語（反対の意味）は？,不幸,幸運,裕福,満足,平和
180,1,文法,「歩く」は何詞？,動詞,名詞,形容詞,副詞,接続詞
181,2,四字熟語,「空前絶後」の意味は？,遥かな過去にも遠い未来にも全く例がないほど非常に珍しい出来事,空が広がっている前で絶望してうずくまり倒れてしまうこと,一日中ご飯を食べなくてお腹がペコペコに空いてしまうこと,並んでいる列で自分の前にも後ろにも全く人がいないこと,日常生活の中でしょっちゅう起こるよくある普通のこと
182,2,慣用句,「足を引っ張る」の意味は？,他人の成功や前進の邪魔をすること,転んだ人を助け起こすこと,足のストレッチをすること,綱引きをすること,足首をつかんでイタズラすること
183,2,ことわざ,「トンビが鷹を生む」の意味は？,ごく平凡な普通の親からとても優れた優秀な子どもが生まれること,ある鳥が全く違う種類の別の鳥の卵を一生懸命温めること,高い空を悠々と飛んでいく大きくて立派な鳥のこと,素晴らしい親から生まれたのに子どもは全くダメになってしまうこと,大きくて強い鷹が自分より小さいトンビをいじめること
184,2,類義語・対義語,「失敗」の類義語（似た意味）は？,ミス,成功,勝利,大勝,後悔
185,2,文法,「しかし」は何詞？,接続詞,副詞,名詞,助詞,動詞
186,3,四字熟語,「奇想天外」の意味は？,普通の人では到底思いつかないような非常に変わった面白い思いつき,遠い宇宙のかなたから地球にやってきた正体不明のエイリアンのこと,誰も見たことのないような空を自由に飛ぶ不思議な乗り物,明日の天気を予想して周りのみんなに教えてあげること,誰もがすぐに頭の中で考えるようなごくごく普通のこと
